source,fetched_at,term,url,title,text,author,region,category,text_clean,tokens
Pinterest,2025-11-03T13:59:33.323091,iphone 17 air,https://www.pinterest.com/pin/4595008753666682368/,the new iphone 11 is shown in white and has an image of a flower on it,the new iphone 11 is shown in white and has an image of a flower on it,,,,the new iphone is shown in white and has an image of a flower on it,"['new', 'iphone', 'shown', 'white', 'image', 'flower']"
Pinterest,2025-11-03T13:59:33.323091,iphone 17 air,https://www.pinterest.com/pin/611926668159106540/,the new iphone 11 is shown in white and has an image of a flower on it,the new iphone 11 is shown in white and has an image of a flower on it,,,,the new iphone is shown in white and has an image of a flower on it,"['new', 'iphone', 'shown', 'white', 'image', 'flower']"
Pinterest,2025-11-03T13:59:33.323091,iphone 17 air,https://www.pinterest.com/pin/4591631011028469248/,two iphones side by side with the same camera,two iphones side by side with the same camera,,,,two iphones side by side with the same camera,"['two', 'iphones', 'side', 'side', 'camera']"
Pinterest,2025-11-03T13:59:33.323091,iphone 17 air,https://www.pinterest.com/pin/79376012180272222/,four iphones are shown in different colors,four iphones are shown in different colors,,,,four iphones are shown in different colors,"['four', 'iphones', 'shown', 'different', 'color']"
Pinterest,2025-11-03T13:59:33.323091,iphone 17 air,https://www.pinterest.com/pin/350154939809629720/,"an advertisement for the iphone 11 air, with its pink case and matching phone cover","an advertisement for the iphone 11 air, with its pink case and matching phone cover",,,,an advertisement for the iphone air with its pink case and matching phone cover,"['advertisement', 'iphone', 'air', 'pink', 'case', 'matching', 'phone', 'cover']"
Pinterest,2025-11-03T13:59:33.323091,iphone 17 air,https://www.pinterest.com/pin/774124931212639/,four different colored iphones sitting next to each other on a white table with black dots,four different colored iphones sitting next to each other on a white table with black dots,,,,four different colored iphones sitting next to each other on a white table with black dots,"['four', 'different', 'colored', 'iphones', 'sitting', 'next', 'white', 'table', 'black', 'dot']"
Pinterest,2025-11-03T13:59:33.323091,iphone 17 air,https://www.pinterest.com/pin/591449363606249927/,"the iphone 11 pro is now available for pre - order in malaysia, and it's price has been dropped","the iphone 11 pro is now available for pre - order in malaysia, and it's price has been dropped",,,,the iphone pro is now available for pre order in malaysia and it s price has been dropped,"['iphone', 'pro', 'available', 'pre', 'order', 'malaysia', 'price', 'dropped']"
Pinterest,2025-11-03T13:59:33.323091,iphone 17 air,https://www.pinterest.com/pin/193373377744779113/,a person holding up an iphone in front of a table with people looking at it,a person holding up an iphone in front of a table with people looking at it,,,,a person holding up an iphone in front of a table with people looking at it,"['person', 'holding', 'iphone', 'front', 'table', 'people', 'looking']"
Pinterest,2025-11-03T13:59:33.323091,iphone 17 air,https://www.pinterest.com/pin/870461434377603510/,an advertisement for the iphone 11 pro and pro max,an advertisement for the iphone 11 pro and pro max,,,,an advertisement for the iphone pro and pro max,"['advertisement', 'iphone', 'pro', 'pro', 'max']"
Pinterest,2025-11-03T13:59:33.324092,iphone 17 air,https://www.pinterest.com/pin/44402746323689109/,"an abstract blue background with curved lines in the shape of letters and numbers, which appear to be made out of glass","an abstract blue background with curved lines in the shape of letters and numbers, which appear to be made out of glass",,,,an abstract blue with curved lines in the shape of letters and numbers which appear to be made out of glass,"['abstract', 'blue', 'curved', 'line', 'shape', 'letter', 'number', 'appear', 'made', 'glass']"
Pinterest,2025-11-03T13:59:33.324092,iphone 17 air,https://www.pinterest.com/pin/722194490285710218/,an advertisement for the iphone 11 air is shown in front of it's back cover,an advertisement for the iphone 11 air is shown in front of it's back cover,,,,an advertisement for the iphone air is shown in front of it s back cover,"['advertisement', 'iphone', 'air', 'shown', 'front', 'back', 'cover']"
Pinterest,2025-11-03T13:59:33.324092,iphone 17 air,https://www.pinterest.com/pin/251638697929254285/,"an abstract image with blue and white petals in the center, on a gray background","an abstract image with blue and white petals in the center, on a gray background",,,,an abstract image with blue and white petals in the center on a gray,"['abstract', 'image', 'blue', 'white', 'petal', 'center', 'gray']"
Pinterest,2025-11-03T13:59:33.324092,iphone 17 air,https://www.pinterest.com/pin/774124931197033/,several different colored iphones sitting on top of a white table next to each other,several different colored iphones sitting on top of a white table next to each other,,,,several different colored iphones sitting on top of a white table next to each other,"['several', 'different', 'colored', 'iphones', 'sitting', 'top', 'white', 'table', 'next']"
Google RSS,2025-11-03T13:59:38.562121,iphone 17 air,https://news.google.com/rss/articles/CBMiywFBVV95cUxPTjNpQ1pDMVN5X2hSamtmamt0eThMUmY5cjU3NWxqWWNMU2R6REZ1ckJYN2FHZXhfdUNmUG5fVjNUNHhjTHZsU3BxSDZ4cC0tWVNSM0p2TEY2bVZ4Vk11Qy1yenJKRkdBakQzX05HZEpzWGl5OWdkeU5QVkRPUXc3U3BXRE9vSENiLWdqamJ2N1FHQ0xrQUp5VWMzSGJqcjAxbVNJck55VlZJWklPei1aSFFOd1MxZ1F1WWNyOWhsQlp0dExIakVjN1ljdw?oc=5,I’ve tested the entire iPhone 17 lineup for over a month — and this is the one you should buy - Tom's Guide,"<a href=""https://news.google.com/rss/articles/CBMiywFBVV95cUxPTjNpQ1pDMVN5X2hSamtmamt0eThMUmY5cjU3NWxqWWNMU2R6REZ1ckJYN2FHZXhfdUNmUG5fVjNUNHhjTHZsU3BxSDZ4cC0tWVNSM0p2TEY2bVZ4Vk11Qy1yenJKRkdBakQzX05HZEpzWGl5OWdkeU5QVkRPUXc3U3BXRE9vSENiLWdqamJ2N1FHQ0xrQUp5VWMzSGJqcjAxbVNJck55VlZJWklPei1aSFFOd1MxZ1F1WWNyOWhsQlp0dExIakVjN1ljdw?oc=5"" target=""_blank"">I’ve tested the entire iPhone 17 lineup for over a month — and this is the one you should buy</a>&nbsp;&nbsp;<font color=""#6f6f6f"">Tom's Guide</font>",,,,i ve tested the entire iphone lineup for over a month and this is the one you should buy tom s guide,"['tested', 'entire', 'iphone', 'lineup', 'month', 'one', 'buy', 'tom', 'guide']"
Google RSS,2025-11-03T13:59:38.562121,iphone 17 air,https://news.google.com/rss/articles/CBMiZEFVX3lxTFAyTXFFTHdxYldJcDQ1Z0lXLV9rblMtR1dJSFdjTUY2YkxDbUZVX0NiREk1em1EV1J5Sktqb3pvMGlLMU5lV0hQNU5SRHRFX1RubmxXNjFxcjUxSXhXYUZqZWZ0MG8?oc=5,"Apple iPhone Air review: Design taken seriously, with few compromises - Android Police","<a href=""https://news.google.com/rss/articles/CBMiZEFVX3lxTFAyTXFFTHdxYldJcDQ1Z0lXLV9rblMtR1dJSFdjTUY2YkxDbUZVX0NiREk1em1EV1J5Sktqb3pvMGlLMU5lV0hQNU5SRHRFX1RubmxXNjFxcjUxSXhXYUZqZWZ0MG8?oc=5"" target=""_blank"">Apple iPhone Air review: Design taken seriously, with few compromises</a>&nbsp;&nbsp;<font color=""#6f6f6f"">Android Police</font>",,,,apple iphone air review design taken seriously with few compromises android police,"['apple', 'iphone', 'air', 'review', 'design', 'taken', 'seriously', 'compromise', 'android', 'police']"
Google RSS,2025-11-03T13:59:38.562121,iphone 17 air,https://news.google.com/rss/articles/CBMiswFBVV95cUxOclFPSk05VmtwS3B2NHpBZnh2MGcwRml2bzJRSWhzdGk2OHlYM0lLWkROTHhYeDctVjlUQUJrdDllXzFtUW5oZy0yTF9ESm44MTl2dmdoNjFjanJrOWJIQmdDVElhZGxkQVJfN3FhY21LTmFkdTBfWTJvYmtqZlZ1N2FSWFJ2RE91Q1dVYWs1Rmp1Ym5RalRLQXprbWx5U3FFSU52VkkySXh5aVI1S2RnVEVWaw?oc=5,Apple iPhone Air review – The thinnest smartphone packs a ton of power - Notebookcheck,"<a href=""https://news.google.com/rss/articles/CBMiswFBVV95cUxOclFPSk05VmtwS3B2NHpBZnh2MGcwRml2bzJRSWhzdGk2OHlYM0lLWkROTHhYeDctVjlUQUJrdDllXzFtUW5oZy0yTF9ESm44MTl2dmdoNjFjanJrOWJIQmdDVElhZGxkQVJfN3FhY21LTmFkdTBfWTJvYmtqZlZ1N2FSWFJ2RE91Q1dVYWs1Rmp1Ym5RalRLQXprbWx5U3FFSU52VkkySXh5aVI1S2RnVEVWaw?oc=5"" target=""_blank"">Apple iPhone Air review – The thinnest smartphone packs a ton of power</a>&nbsp;&nbsp;<font color=""#6f6f6f"">Notebookcheck</font>",,,,apple iphone air review the thinnest smartphone packs a ton of power notebookcheck,"['apple', 'iphone', 'air', 'review', 'thinnest', 'smartphone', 'pack', 'ton', 'power', 'notebookcheck']"
Google RSS,2025-11-03T13:59:38.562121,iphone 17 air,https://news.google.com/rss/articles/CBMijAFBVV95cUxPTF9OWXVLVm45b3lWWVZfVXhSMmpZdEliSm9TQk01eHB3WVlfYVpFVXB6cXptMUdZNVZWY1FpREtXd0pDNDlnejU3WkFYNFFENVM5SUdWb3phSU5YSHFUUG9LMldjcU5SLXZTRnVoR0liM2tLcnE1YS1SVF9oOUlEV0FPelJPNHJ5SWI2OdIBkgFBVV95cUxQeTJjRWZndGdzcXlCN3pYUWtVY1oyQXFzem9rOHE0bEpNTU5EVkNDM3VkX0oxY3pEU2N6b3pWWVpjb3laTTNMRFhyQm1IbkZkbWJVUFp1YU54VE50Y2NEcnVLMTVOWXFlYkR3ak50ZUxiaktESWE0MjNDa2U0UUt3MURKOXNNU3JGR1U3azBuRlRiQQ?oc=5,Apple's iPhone Air doesn't look like a bestseller. It might not matter - CNBC,"<a href=""https://news.google.com/rss/articles/CBMijAFBVV95cUxPTF9OWXVLVm45b3lWWVZfVXhSMmpZdEliSm9TQk01eHB3WVlfYVpFVXB6cXptMUdZNVZWY1FpREtXd0pDNDlnejU3WkFYNFFENVM5SUdWb3phSU5YSHFUUG9LMldjcU5SLXZTRnVoR0liM2tLcnE1YS1SVF9oOUlEV0FPelJPNHJ5SWI2OdIBkgFBVV95cUxQeTJjRWZndGdzcXlCN3pYUWtVY1oyQXFzem9rOHE0bEpNTU5EVkNDM3VkX0oxY3pEU2N6b3pWWVpjb3laTTNMRFhyQm1IbkZkbWJVUFp1YU54VE50Y2NEcnVLMTVOWXFlYkR3ak50ZUxiaktESWE0MjNDa2U0UUt3MURKOXNNU3JGR1U3azBuRlRiQQ?oc=5"" target=""_blank"">Apple's iPhone Air doesn't look like a bestseller. It might not matter</a>&nbsp;&nbsp;<font color=""#6f6f6f"">CNBC</font>",,,,apple s iphone air doesn t look like a bestseller it might not matter cnbc,"['apple', 'iphone', 'air', 'look', 'like', 'bestseller', 'might', 'matter', 'cnbc']"
Google RSS,2025-11-03T13:59:38.562121,iphone 17 air,https://news.google.com/rss/articles/CBMipgFBVV95cUxQakdRVVZuRFIwbHFzejJoczk0Y3hfUnMzei05SVJsVGY4Ty1tN2hNcnNSamNvTnYwRWxnOTY1TFJYcWtQR2NDOW5vOXJsSE51LW9kRWRPNFowMVZCT0RYcmhJN2czNndwZ0dpTEc3M2xWODc4TXlSRm01ZnZOM2lfVzBTV21nZk5hcTdLQXY2RWNwSk40aWNxME1pMW01bnRBSFlXaTdn?oc=5,Which 2025 iPhone Has the Best Battery? I've Crowned a New Power Winner - CNET,"<a href=""https://news.google.com/rss/articles/CBMipgFBVV95cUxQakdRVVZuRFIwbHFzejJoczk0Y3hfUnMzei05SVJsVGY4Ty1tN2hNcnNSamNvTnYwRWxnOTY1TFJYcWtQR2NDOW5vOXJsSE51LW9kRWRPNFowMVZCT0RYcmhJN2czNndwZ0dpTEc3M2xWODc4TXlSRm01ZnZOM2lfVzBTV21nZk5hcTdLQXY2RWNwSk40aWNxME1pMW01bnRBSFlXaTdn?oc=5"" target=""_blank"">Which 2025 iPhone Has the Best Battery? I've Crowned a New Power Winner</a>&nbsp;&nbsp;<font color=""#6f6f6f"">CNET</font>",,,,which iphone has the best battery i ve crowned a new power winner cnet,"['iphone', 'best', 'battery', 'crowned', 'new', 'power', 'winner', 'cnet']"
Google RSS,2025-11-03T13:59:38.562121,iphone 17 air,https://news.google.com/rss/articles/CBMijAFBVV95cUxQN2NYTE9QdnhhSTBkZV9JWENSRmsyN29IU2dycWpINTczTHN6amtvU200VE55UWpQN2t3Um5MNDFRZ19fN01CVTlpNXNFOGVfcFZDOVNqVE1tbS11UEdqN2s4VDN4XzdyVUZuNlVIeWRoY2E5RG1Cbm1STWFyN3FqZ2FfRWVoeDM1SVlRaw?oc=5,"Apple Releases iPhone 17, iPhone 17 Pro, and iPhone Air Parts and Tools for Do-It-Yourself Repairs - MacRumors","<a href=""https://news.google.com/rss/articles/CBMijAFBVV95cUxQN2NYTE9QdnhhSTBkZV9JWENSRmsyN29IU2dycWpINTczTHN6amtvU200VE55UWpQN2t3Um5MNDFRZ19fN01CVTlpNXNFOGVfcFZDOVNqVE1tbS11UEdqN2s4VDN4XzdyVUZuNlVIeWRoY2E5RG1Cbm1STWFyN3FqZ2FfRWVoeDM1SVlRaw?oc=5"" target=""_blank"">Apple Releases iPhone 17, iPhone 17 Pro, and iPhone Air Parts and Tools for Do-It-Yourself Repairs</a>&nbsp;&nbsp;<font color=""#6f6f6f"">MacRumors</font>",,,,apple releases iphone iphone pro and iphone air parts and tools for do it yourself repairs macrumors,"['apple', 'release', 'iphone', 'iphone', 'pro', 'iphone', 'air', 'part', 'tool', 'repair', 'macrumors']"
Google RSS,2025-11-03T13:59:38.562121,iphone 17 air,https://news.google.com/rss/articles/CBMijwFBVV95cUxNMjJqSENhQ2p2b3RGMmdobnloczRwMk9aamxHQUo5cGZLa1Ztbm9LUUh1M2pZbnVTTzc5aFhlV0U2SzM2RlozLUs1X3hXeTZHQi1fem9EZ1ZRX3EwcjlCY0U4SzQ0NDNUU0RDblQ2Y2NwdEg1TEY5dnoxUWpyNGJVRFhNVzJjZGxzRXVmbTJGdw?oc=5,"Apple is 'drastically' cutting iPhone Air production, report says, after new survey reveals 'virtually no demand' - Fortune","<a href=""https://news.google.com/rss/articles/CBMijwFBVV95cUxNMjJqSENhQ2p2b3RGMmdobnloczRwMk9aamxHQUo5cGZLa1Ztbm9LUUh1M2pZbnVTTzc5aFhlV0U2SzM2RlozLUs1X3hXeTZHQi1fem9EZ1ZRX3EwcjlCY0U4SzQ0NDNUU0RDblQ2Y2NwdEg1TEY5dnoxUWpyNGJVRFhNVzJjZGxzRXVmbTJGdw?oc=5"" target=""_blank"">Apple is 'drastically' cutting iPhone Air production, report says, after new survey reveals 'virtually no demand'</a>&nbsp;&nbsp;<font color=""#6f6f6f"">Fortune</font>",,,,apple is drastically cutting iphone air production report says after new survey reveals virtually no demand fortune,"['apple', 'drastically', 'cutting', 'iphone', 'air', 'production', 'report', 'say', 'new', 'survey', 'reveals', 'virtually', 'demand', 'fortune']"
Google RSS,2025-11-03T13:59:38.562121,iphone 17 air,https://news.google.com/rss/articles/CBMidEFVX3lxTE1mbFpOTm4yWjdqMC0tazQwanUxNjNhckVXbnVpV1E2M01nZjAzZ29Jcld1UEt0cDFsWTdIcVEtaHVScGphZTVnTG5NUUswYUpmdHhZSFFBb3ltWVdpSE9uZHJGTmJDYTgzaUlPSl91SVN2RkZY?oc=5,iPhone 17 matches iPhone Air display performance in DXOMARK test - 9to5Mac,"<a href=""https://news.google.com/rss/articles/CBMidEFVX3lxTE1mbFpOTm4yWjdqMC0tazQwanUxNjNhckVXbnVpV1E2M01nZjAzZ29Jcld1UEt0cDFsWTdIcVEtaHVScGphZTVnTG5NUUswYUpmdHhZSFFBb3ltWVdpSE9uZHJGTmJDYTgzaUlPSl91SVN2RkZY?oc=5"" target=""_blank"">iPhone 17 matches iPhone Air display performance in DXOMARK test</a>&nbsp;&nbsp;<font color=""#6f6f6f"">9to5Mac</font>",,,,iphone matches iphone air display performance in dxomark test to mac,"['iphone', 'match', 'iphone', 'air', 'display', 'performance', 'dxomark', 'test', 'mac']"
Google RSS,2025-11-03T13:59:38.562121,iphone 17 air,https://news.google.com/rss/articles/CBMiWkFVX3lxTFB5YWs1WGpCSjJVSGN4N2lyRms0NHRLN3Zjc2MxQjJwSldlcWRrRjFWMG91YVZIaHpKOXRFdFlPYk5MWTlwaTVpX1FVTEZnTDhJZkZLMUFOdG9oQdIBX0FVX3lxTE5zYUg2RHRxS014Rll4MFY1V3AtMVpZb1ZvaTZwUmhXZW1MNk92VmFJSDhtazVMUGg5RlNMVFZYYzhTZjhGelozUDlWUmE5SkNlT2NiU0pSc2xEbnp0Zm5N?oc=5,Apple claims 'tremendous' global uptake of latest iPhones - BBC,"<a href=""https://news.google.com/rss/articles/CBMiWkFVX3lxTFB5YWs1WGpCSjJVSGN4N2lyRms0NHRLN3Zjc2MxQjJwSldlcWRrRjFWMG91YVZIaHpKOXRFdFlPYk5MWTlwaTVpX1FVTEZnTDhJZkZLMUFOdG9oQdIBX0FVX3lxTE5zYUg2RHRxS014Rll4MFY1V3AtMVpZb1ZvaTZwUmhXZW1MNk92VmFJSDhtazVMUGg5RlNMVFZYYzhTZjhGelozUDlWUmE5SkNlT2NiU0pSc2xEbnp0Zm5N?oc=5"" target=""_blank"">Apple claims 'tremendous' global uptake of latest iPhones</a>&nbsp;&nbsp;<font color=""#6f6f6f"">BBC</font>",,,,apple claims tremendous global uptake of latest iphones bbc,"['apple', 'claim', 'tremendous', 'global', 'uptake', 'latest', 'iphones', 'bbc']"
Google RSS,2025-11-03T13:59:38.562121,iphone 17 air,https://news.google.com/rss/articles/CBMidkFVX3lxTFBzbkQ4Q3VOU2dJZ1F5SEYyS3p0WlkwbnNHSzZvNnowMDlpTDRRR2FSZ1UxWUlOZ3lBbElMZTBZZDZMYVIwdnhrSEZwMUlPVmcyN29VU1RiS0RrazhaclJwRXJqMjVHQmlwaFZPZEkzV0lPNkx6MUE?oc=5,I've Tested More Than 70 Cases for the iPhone 17 Lineup. This Is the Ultimate Case Guide - WIRED,"<a href=""https://news.google.com/rss/articles/CBMidkFVX3lxTFBzbkQ4Q3VOU2dJZ1F5SEYyS3p0WlkwbnNHSzZvNnowMDlpTDRRR2FSZ1UxWUlOZ3lBbElMZTBZZDZMYVIwdnhrSEZwMUlPVmcyN29VU1RiS0RrazhaclJwRXJqMjVHQmlwaFZPZEkzV0lPNkx6MUE?oc=5"" target=""_blank"">I've Tested More Than 70 Cases for the iPhone 17 Lineup. This Is the Ultimate Case Guide</a>&nbsp;&nbsp;<font color=""#6f6f6f"">WIRED</font>",,,,i ve tested more than cases for the iphone lineup this is the ultimate case guide wired,"['tested', 'case', 'iphone', 'lineup', 'ultimate', 'case', 'guide', 'wired']"
Google RSS,2025-11-03T13:59:38.562121,iphone 17 air,https://news.google.com/rss/articles/CBMimgFBVV95cUxOMDBZaFYxMmVmVXZ3TEdoT0RIQ0hTTVNVdGQzalVqaVd6LWxFYS1lV0ZSbVpId21wdUtwOUZpampOcXVRVkJVSkQxSkpPTjRmTlJnWnd2c2ZEaGlwR01VWlh5Y0wtQXFSdkpHQ2wwR2dYVndrTmI5TmlILXFZNzVmYkpuQmZPV3JZOEI2VFY2dzhkbVZUSlFEV0Zn?oc=5,iPhone Air vs. Galaxy S25 Edge: Which Thin Phone Fits You Best? - CNET,"<a href=""https://news.google.com/rss/articles/CBMimgFBVV95cUxOMDBZaFYxMmVmVXZ3TEdoT0RIQ0hTTVNVdGQzalVqaVd6LWxFYS1lV0ZSbVpId21wdUtwOUZpampOcXVRVkJVSkQxSkpPTjRmTlJnWnd2c2ZEaGlwR01VWlh5Y0wtQXFSdkpHQ2wwR2dYVndrTmI5TmlILXFZNzVmYkpuQmZPV3JZOEI2VFY2dzhkbVZUSlFEV0Zn?oc=5"" target=""_blank"">iPhone Air vs. Galaxy S25 Edge: Which Thin Phone Fits You Best?</a>&nbsp;&nbsp;<font color=""#6f6f6f"">CNET</font>",,,,iphone air vs galaxy s edge which thin phone fits you best cnet,"['iphone', 'air', 'galaxy', 'edge', 'thin', 'phone', 'fit', 'best', 'cnet']"
Google RSS,2025-11-03T13:59:38.562121,iphone 17 air,https://news.google.com/rss/articles/CBMi1AFBVV95cUxPb21nUm9CRHRLN2c4TUZXa1hkdkd5SEVYekx0UGpLNVlXSDViZXlJN3ZNUG5UUThBWW0yeHRMX2FZclkzS3FiVHpPZDV5UU1DelR5QkZxRlhoTUoyMmk1ck44NFk2NDlKaHNBaVktaWwwbVhZQ2xoR3hpVjFmU0g0dzRmNlNsTHl5NVZ1YmpWOE5wb0Fqcy04SVBmd0MtU0FRUmxQLThpMnNJbFMxLVBMZ18xdHNYUU8yNC1tVmE5STRZZ2E2RDNUay1TTnB4dXpoM2ZDbQ?oc=5,Apple starts selling replacement parts for iPhone 17 (Pro) and iPhone Air at partly high prices - Notebookcheck,"<a href=""https://news.google.com/rss/articles/CBMi1AFBVV95cUxPb21nUm9CRHRLN2c4TUZXa1hkdkd5SEVYekx0UGpLNVlXSDViZXlJN3ZNUG5UUThBWW0yeHRMX2FZclkzS3FiVHpPZDV5UU1DelR5QkZxRlhoTUoyMmk1ck44NFk2NDlKaHNBaVktaWwwbVhZQ2xoR3hpVjFmU0g0dzRmNlNsTHl5NVZ1YmpWOE5wb0Fqcy04SVBmd0MtU0FRUmxQLThpMnNJbFMxLVBMZ18xdHNYUU8yNC1tVmE5STRZZ2E2RDNUay1TTnB4dXpoM2ZDbQ?oc=5"" target=""_blank"">Apple starts selling replacement parts for iPhone 17 (Pro) and iPhone Air at partly high prices</a>&nbsp;&nbsp;<font color=""#6f6f6f"">Notebookcheck</font>",,,,apple starts selling replacement parts for iphone pro and iphone air at partly high prices notebookcheck,"['apple', 'start', 'selling', 'replacement', 'part', 'iphone', 'pro', 'iphone', 'air', 'partly', 'high', 'price', 'notebookcheck']"
Google RSS,2025-11-03T13:59:38.562121,iphone 17 air,https://news.google.com/rss/articles/CBMioAFBVV95cUxPVm5zZXBBNU5jcWx5SWk0VmFITmotWEZ1NzZYUXlGallNSUlyRzk4SE0yS19KRTVhQUpwSmpfeDRDQVZoX3Q4Rjh4WTd0R0h6VUZudlhuTUFpc3pCQVdXRXZySUdrYjBhd1U1NFBUNlN2X0VGVURjWWM4d2k0bTFadi11WnNkaTJYVTNrajdad3N2anRRZkVVSWlVU012UWx5?oc=5,iPhone Air vs. iPhone 17 Pro: Reevaluating after two weeks - AppleInsider,"<a href=""https://news.google.com/rss/articles/CBMioAFBVV95cUxPVm5zZXBBNU5jcWx5SWk0VmFITmotWEZ1NzZYUXlGallNSUlyRzk4SE0yS19KRTVhQUpwSmpfeDRDQVZoX3Q4Rjh4WTd0R0h6VUZudlhuTUFpc3pCQVdXRXZySUdrYjBhd1U1NFBUNlN2X0VGVURjWWM4d2k0bTFadi11WnNkaTJYVTNrajdad3N2anRRZkVVSWlVU012UWx5?oc=5"" target=""_blank"">iPhone Air vs. iPhone 17 Pro: Reevaluating after two weeks</a>&nbsp;&nbsp;<font color=""#6f6f6f"">AppleInsider</font>",,,,iphone air vs iphone pro reevaluating after two weeks appleinsider,"['iphone', 'air', 'iphone', 'pro', 'reevaluating', 'two', 'week', 'appleinsider']"
Google RSS,2025-11-03T13:59:38.562121,iphone 17 air,https://news.google.com/rss/articles/CBMifEFVX3lxTFB1MFFKbTJiNW84QzJ1Yy1WZTRzVnpIZnZwcE93d2FBMGFvVmZsc1d5OFR1TUJiYkVDd1duTDQ2dU9kemxSY0pNNXNRbVJjTGRDTWVHRnpjUjRienVwbGZiQTB5R0dRTFpmdFduZUxRQWg5bXh6T1hBaFhrSDE?oc=5,iPhone Air review: Back to the future - Six Colors,"<a href=""https://news.google.com/rss/articles/CBMifEFVX3lxTFB1MFFKbTJiNW84QzJ1Yy1WZTRzVnpIZnZwcE93d2FBMGFvVmZsc1d5OFR1TUJiYkVDd1duTDQ2dU9kemxSY0pNNXNRbVJjTGRDTWVHRnpjUjRienVwbGZiQTB5R0dRTFpmdFduZUxRQWg5bXh6T1hBaFhrSDE?oc=5"" target=""_blank"">iPhone Air review: Back to the future</a>&nbsp;&nbsp;<font color=""#6f6f6f"">Six Colors</font>",,,,iphone air review back to the future six colors,"['iphone', 'air', 'review', 'back', 'future', 'six', 'color']"
Google RSS,2025-11-03T13:59:38.562121,iphone 17 air,https://news.google.com/rss/articles/CBMiWEFVX3lxTE12b3Q5aXFvcnNKaEptVFNXUjcyT2pXbE1GNUMzSkltT3VkVGluTGJZV09aLWZGMXlFaTk2VWl5SHRWSXNYQk9xbGtsaTlteXRvNGFqak1pdnQ?oc=5,iPhone Air: Everything We Know - MacRumors,"<a href=""https://news.google.com/rss/articles/CBMiWEFVX3lxTE12b3Q5aXFvcnNKaEptVFNXUjcyT2pXbE1GNUMzSkltT3VkVGluTGJZV09aLWZGMXlFaTk2VWl5SHRWSXNYQk9xbGtsaTlteXRvNGFqak1pdnQ?oc=5"" target=""_blank"">iPhone Air: Everything We Know</a>&nbsp;&nbsp;<font color=""#6f6f6f"">MacRumors</font>",,,,iphone air everything we know macrumors,"['iphone', 'air', 'everything', 'know', 'macrumors']"
Google RSS,2025-11-03T13:59:38.562121,iphone 17 air,https://news.google.com/rss/articles/CBMickFVX3lxTE9rV3RIX1MwbjB0b01ORzc4Y1laTThxYkJ1MXY1MlBZdVp0YUttdXAtZ3JfMGpGTUROS0l4TFFpa2I1OVNYRGpQNHhlbzJKcF9RMHBWbzJfLVdiZUlCUWtTTlh3b3hmYzdjVWNPeE9GN1FrQQ?oc=5,Get a Free iPhone 17 Pro From T-Mobile With Trade-in - IGN,"<a href=""https://news.google.com/rss/articles/CBMickFVX3lxTE9rV3RIX1MwbjB0b01ORzc4Y1laTThxYkJ1MXY1MlBZdVp0YUttdXAtZ3JfMGpGTUROS0l4TFFpa2I1OVNYRGpQNHhlbzJKcF9RMHBWbzJfLVdiZUlCUWtTTlh3b3hmYzdjVWNPeE9GN1FrQQ?oc=5"" target=""_blank"">Get a Free iPhone 17 Pro From T-Mobile With Trade-in</a>&nbsp;&nbsp;<font color=""#6f6f6f"">IGN</font>",,,,get a free iphone pro from t mobile with trade in ign,"['get', 'free', 'iphone', 'pro', 'mobile', 'trade', 'ign']"
Google RSS,2025-11-03T13:59:38.562121,iphone 17 air,https://news.google.com/rss/articles/CBMif0FVX3lxTE8xY3pPQXoxZzVSaUJpTUtYYjBpUmtOcU13Z3pabEpTREI5WE4tOGo2MjhQRkFPVzBaM1V3QkZCVGdQOU5wQTBWbnRyVWVkbjExckx5RHlkYTNLSkV6bFJiVFVHNmtsTFQzeVZHcHhtRlRuM0xJRTVpLWdzTFMtYlU?oc=5,"Camera shootout: I compared iPhone 17, iPhone Air, and iPhone 17 Pro Max photos side-by-side - Mashable","<a href=""https://news.google.com/rss/articles/CBMif0FVX3lxTE8xY3pPQXoxZzVSaUJpTUtYYjBpUmtOcU13Z3pabEpTREI5WE4tOGo2MjhQRkFPVzBaM1V3QkZCVGdQOU5wQTBWbnRyVWVkbjExckx5RHlkYTNLSkV6bFJiVFVHNmtsTFQzeVZHcHhtRlRuM0xJRTVpLWdzTFMtYlU?oc=5"" target=""_blank"">Camera shootout: I compared iPhone 17, iPhone Air, and iPhone 17 Pro Max photos side-by-side</a>&nbsp;&nbsp;<font color=""#6f6f6f"">Mashable</font>",,,,camera shootout i compared iphone iphone air and iphone pro max photos side by side mashable,"['camera', 'shootout', 'compared', 'iphone', 'iphone', 'air', 'iphone', 'pro', 'max', 'photo', 'side', 'side', 'mashable']"
Google RSS,2025-11-03T13:59:38.562121,iphone 17 air,https://news.google.com/rss/articles/CBMicEFVX3lxTE1tMkl1VEFTVGNDdURQcXJpRHc1ZEpBeHktcDdxeElLVjFaNjVacmRra0Z1RUc0X200SnFRSFpfQ2JyM0VkQnJHYUZhTU1ET19OSzhkWFQxR2hVcXhnc0dPaXNwQ1BjVzI4d1Fpb2M4Y2g?oc=5,"The Best iPhone Case for iPhone 17, 17 Plus, 17 Pro, 17 Pro Max, and iPhone Air - The New York Times","<a href=""https://news.google.com/rss/articles/CBMicEFVX3lxTE1tMkl1VEFTVGNDdURQcXJpRHc1ZEpBeHktcDdxeElLVjFaNjVacmRra0Z1RUc0X200SnFRSFpfQ2JyM0VkQnJHYUZhTU1ET19OSzhkWFQxR2hVcXhnc0dPaXNwQ1BjVzI4d1Fpb2M4Y2g?oc=5"" target=""_blank"">The Best iPhone Case for iPhone 17, 17 Plus, 17 Pro, 17 Pro Max, and iPhone Air</a>&nbsp;&nbsp;<font color=""#6f6f6f"">The New York Times</font>",,,,the best iphone case for iphone plus pro pro max and iphone air the new york times,"['best', 'iphone', 'case', 'iphone', 'plus', 'pro', 'pro', 'max', 'iphone', 'air', 'new', 'york', 'time']"
Google RSS,2025-11-03T13:59:38.562121,iphone 17 air,https://news.google.com/rss/articles/CBMiSEFVX3lxTFBKMXBFdFEzSDUzclA2ZGhpWWNyYjY4NWNlWi1pOHB4U3pXUnUtNHFPbmVVdjYzbGtZZkVSTEtaY0wzUlhiN0NTdw?oc=5,iPhone Air - Apple,"<a href=""https://news.google.com/rss/articles/CBMiSEFVX3lxTFBKMXBFdFEzSDUzclA2ZGhpWWNyYjY4NWNlWi1pOHB4U3pXUnUtNHFPbmVVdjYzbGtZZkVSTEtaY0wzUlhiN0NTdw?oc=5"" target=""_blank"">iPhone Air</a>&nbsp;&nbsp;<font color=""#6f6f6f"">Apple</font>",,,,iphone air apple,"['iphone', 'air', 'apple']"
Google RSS,2025-11-03T13:59:38.562121,iphone 17 air,https://news.google.com/rss/articles/CBMimwFBVV95cUxNVV9KOWZMeXAxUFFPT21TY0RRSmN5elhjRkZiWXY5VmNSYjg1cV8zaFZ4bHpNNXFaOHdGa2UteW40c1J1Zl9PQ3B4RnoyYXNROV9TajNRcWtYYWxBR29ZU1hPZjdfUEFQUHhVcW13RkYtTktUNkh2QVd6dmNIWjBiNmRpeDJfX1hnVGhaMkdBRkZvQ2JTWHhKMjhDdw?oc=5,The iPhone 17 Is the True Star of Apple's New Phone Lineup - Consumer Reports,"<a href=""https://news.google.com/rss/articles/CBMimwFBVV95cUxNVV9KOWZMeXAxUFFPT21TY0RRSmN5elhjRkZiWXY5VmNSYjg1cV8zaFZ4bHpNNXFaOHdGa2UteW40c1J1Zl9PQ3B4RnoyYXNROV9TajNRcWtYYWxBR29ZU1hPZjdfUEFQUHhVcW13RkYtTktUNkh2QVd6dmNIWjBiNmRpeDJfX1hnVGhaMkdBRkZvQ2JTWHhKMjhDdw?oc=5"" target=""_blank"">The iPhone 17 Is the True Star of Apple's New Phone Lineup</a>&nbsp;&nbsp;<font color=""#6f6f6f"">Consumer Reports</font>",,,,the iphone is the true star of apple s new phone lineup consumer reports,"['iphone', 'true', 'star', 'apple', 'new', 'phone', 'lineup', 'consumer', 'report']"
Yahoo News,2025-11-03T13:59:39.206500,iphone 17 air,https://r.search.yahoo.com/_ylt=Awr93EdLtQhpDoYSwQ_QtDMD;_ylu=Y29sbwNncTEEcG9zAzEEdnRpZAMEc2VjA3Ny/RV=2/RE=1763387979/RO=10/RU=https%3a%2f%2fwww.cnet.com%2ftech%2fmobile%2fiphone-air-vs-galaxy-s25-edge-which-thin-phone-fits-you-best%2f/RK=2/RS=6_Q19yXez5FMr3h1G01VVNQCXQs-,iPhone Air vs. Galaxy S25 Edge: Which Thin Phone Fits You Best?,iPhone Air vs. Galaxy S25 Edge: Which Thin Phone Fits You Best?,,,,iphone air vs galaxy s edge which thin phone fits you best,"['iphone', 'air', 'galaxy', 'edge', 'thin', 'phone', 'fit', 'best']"
Yahoo News,2025-11-03T13:59:39.206500,iphone 17 air,https://r.search.yahoo.com/_ylt=Awr93EdLtQhpDoYSxA_QtDMD;_ylu=Y29sbwNncTEEcG9zAzIEdnRpZAMEc2VjA3Ny/RV=2/RE=1763387979/RO=10/RU=https%3a%2f%2ftech.yahoo.com%2fphones%2farticles%2fapple-iphone-air-17-smartphone-180000683.html/RK=2/RS=g9gnAB1fic7Lt8c.LDXlV5gqWV4-,Apple iPhone Air 17 Smartphone Review,Apple iPhone Air 17 Smartphone Review,,,,apple iphone air smartphone review,"['apple', 'iphone', 'air', 'smartphone', 'review']"
