source,fetched_at,term,url,title,text,author,region,category,text_clean,tokens
Pinterest,2025-11-03T13:59:10.186075,iphone 17 pro,https://www.pinterest.com/pin/963348176558258469/,a pair of glasses sitting on top of a white counter next to an orange case,a pair of glasses sitting on top of a white counter next to an orange case,,,,a pair of glasses sitting on top of a white counter next to an orange case,"['pair', 'glass', 'sitting', 'top', 'white', 'counter', 'next', 'orange', 'case']"
Pinterest,2025-11-03T13:59:10.186075,iphone 17 pro,https://www.pinterest.com/pin/4594375393945483776/,two cell phones with hearts on them are being held up by someone's hand,two cell phones with hearts on them are being held up by someone's hand,,,,two cell phones with hearts on them are being held up by someone s hand,"['two', 'cell', 'phone', 'heart', 'held', 'someone', 'hand']"
Pinterest,2025-11-03T13:59:10.186075,iphone 17 pro,https://www.pinterest.com/pin/972707219561770362/,Close-up of a 2025 iPhone 17 Pro case with a minimal Apple-style design and textured finish in modern tones.,Close-up of a 2025 iPhone 17 Pro case with a minimal Apple-style design and textured finish in modern tones.,,,,close up of a iphone pro case with a minimal apple design and textured finish in modern tones,"['close', 'iphone', 'pro', 'case', 'minimal', 'apple', 'design', 'textured', 'finish', 'modern', 'tone']"
Pinterest,2025-11-03T13:59:10.186075,iphone 17 pro,https://www.pinterest.com/pin/80501912085785207/,an orange iphone case is being held up in front of a black phone with the camera lens,an orange iphone case is being held up in front of a black phone with the camera lens,,,,an orange iphone case is being held up in front of a black phone with the camera lens,"['orange', 'iphone', 'case', 'held', 'front', 'black', 'phone', 'camera', 'lens']"
Pinterest,2025-11-03T13:59:10.186075,iphone 17 pro,https://www.pinterest.com/pin/11892386513448725/,the letter s is made up of glass,the letter s is made up of glass,,,,the letter s is made up of glass,"['letter', 'made', 'glass']"
Pinterest,2025-11-03T13:59:10.186075,iphone 17 pro,https://www.pinterest.com/pin/89157267629839542/,"a person holding an iphone in their hand with headphones on top of it and the text, iphone 4 pro unboxing","a person holding an iphone in their hand with headphones on top of it and the text, iphone 4 pro unboxing",,,,a person holding an iphone in their hand with headphones on top of it and the text iphone pro unboxing,"['person', 'holding', 'iphone', 'hand', 'headphone', 'top', 'text', 'iphone', 'pro', 'unboxing']"
Pinterest,2025-11-03T13:59:10.186075,iphone 17 pro,https://www.pinterest.com/pin/663295851411565350/,a pink cell phone with stickers on it sitting on the floor next to a carpet,a pink cell phone with stickers on it sitting on the floor next to a carpet,,,,a pink cell phone with stickers on it sitting on the floor next to a carpet,"['pink', 'cell', 'phone', 'sticker', 'sitting', 'floor', 'next', 'carpet']"
Pinterest,2025-11-03T13:59:10.186075,iphone 17 pro,https://www.pinterest.com/pin/58617232657599496/,a man and woman taking a selfie in front of an apple store with the text 4 new iphone 17 tricks,a man and woman taking a selfie in front of an apple store with the text 4 new iphone 17 tricks,,,,a man and woman taking a selfie in front of an apple store with the text new iphone tricks,"['man', 'woman', 'taking', 'selfie', 'front', 'apple', 'store', 'text', 'new', 'iphone', 'trick']"
Pinterest,2025-11-03T13:59:10.186075,iphone 17 pro,https://www.pinterest.com/pin/184647653468177540/,a person holding up an iphone case in front of their face with the camera on it,a person holding up an iphone case in front of their face with the camera on it,,,,a person holding up an iphone case in front of their face with the camera on it,"['person', 'holding', 'iphone', 'case', 'front', 'face', 'camera']"
Pinterest,2025-11-03T13:59:10.186075,iphone 17 pro,https://www.pinterest.com/pin/867013365774959858/,the new iphone 11 pro is shown in orange,the new iphone 11 pro is shown in orange,,,,the new iphone pro is shown in orange,"['new', 'iphone', 'pro', 'shown', 'orange']"
Pinterest,2025-11-03T13:59:10.186075,iphone 17 pro,https://www.pinterest.com/pin/337066353383433851/,"Iphone 17 Pro Max Games Room Inspiration, Room Inspiration, Game Room, Iphone","Iphone 17 Pro Max Games Room Inspiration, Room Inspiration, Game Room, Iphone",,,,iphone pro max games room inspiration room inspiration game room iphone,"['iphone', 'pro', 'max', 'game', 'room', 'inspiration', 'room', 'inspiration', 'game', 'room', 'iphone']"
Pinterest,2025-11-03T13:59:10.186075,iphone 17 pro,https://www.pinterest.com/pin/319614904830046171/,a woman holding three different cell phones in her hands and looking at the camera with one hand,a woman holding three different cell phones in her hands and looking at the camera with one hand,,,,a woman holding three different cell phones in her hands and looking at the camera with one hand,"['woman', 'holding', 'three', 'different', 'cell', 'phone', 'hand', 'looking', 'camera', 'one', 'hand']"
Pinterest,2025-11-03T13:59:10.186075,iphone 17 pro,https://www.pinterest.com/pin/72831718973283835/,an advertisement for the iphone 11 pro and its price is shown in three different colors,an advertisement for the iphone 11 pro and its price is shown in three different colors,,,,an advertisement for the iphone pro and its price is shown in three different colors,"['advertisement', 'iphone', 'pro', 'price', 'shown', 'three', 'different', 'color']"
Pinterest,2025-11-03T13:59:10.186075,iphone 17 pro,https://www.pinterest.com/pin/975521969297018930/,a person holding up a cell phone case with an iphone in it's hand,a person holding up a cell phone case with an iphone in it's hand,,,,a person holding up a cell phone case with an iphone in it s hand,"['person', 'holding', 'cell', 'phone', 'case', 'iphone', 'hand']"
Pinterest,2025-11-03T13:59:10.186075,iphone 17 pro,https://www.pinterest.com/pin/192951165281167716/,"an orange iphone 11 pro is shown in front of the camera, with two different angles","an orange iphone 11 pro is shown in front of the camera, with two different angles",,,,an orange iphone pro is shown in front of the camera with two different angles,"['orange', 'iphone', 'pro', 'shown', 'front', 'camera', 'two', 'different', 'angle']"
Pinterest,2025-11-03T13:59:10.186075,iphone 17 pro,https://www.pinterest.com/pin/806566614556975106/,an apple phone sitting on top of a table next to a vase with dried grass in it,an apple phone sitting on top of a table next to a vase with dried grass in it,,,,an apple phone sitting on top of a table next to a vase with dried grass in it,"['apple', 'phone', 'sitting', 'top', 'table', 'next', 'vase', 'dried', 'grass']"
Pinterest,2025-11-03T13:59:10.186075,iphone 17 pro,https://www.pinterest.com/pin/54395107995143918/,"Xiaomi’s 17 Pro Max takes the camera plateau to a new level with a rear display that wraps around its lenses, adding utility and style. The secondary screen can show clocks, notifications, or act as a","Xiaomi’s 17 Pro Max takes the camera plateau to a new level with a rear display that wraps around its lenses, adding utility and style. The secondary screen can show clocks, notifications, or act as a viewfinder, making every shot easier and more interactive. By turning unused space into functional design, Xiaomi enhances photography, multitasking, and daily use, creating a fresh perspective on flagship smartphone experiences. Learn More!
​ Pedal Power, Blender Tutorial, Pro Camera, Yanko Design, Latest Iphone, Flip Phones, Camera Lenses, Telephones, Multi Tasking",,,,xiaomi s pro max takes the camera plateau to a new level with a rear display that wraps around its lenses adding utility and the secondary screen can show clocks notifications or act as a viewfinder making every shot easier and more interactive by turning unused space into functional design xiaomi enhances photography multitasking and daily use creating a fresh perspective on flagship smartphone experiences learn more pedal power blender tutorial pro camera yanko design latest iphone flip phones camera lenses telephones multi tasking,"['xiaomi', 'pro', 'max', 'take', 'camera', 'plateau', 'new', 'level', 'rear', 'display', 'wrap', 'around', 'lens', 'adding', 'utility', 'secondary', 'screen', 'show', 'clock', 'notification', 'act', 'viewfinder', 'making', 'every', 'shot', 'easier', 'interactive', 'turning', 'unused', 'space', 'functional', 'design', 'xiaomi', 'enhances', 'photography', 'multitasking', 'daily', 'use', 'creating', 'fresh', 'perspective', 'flagship', 'smartphone', 'experience', 'learn', 'pedal', 'power', 'blender', 'tutorial', 'pro', 'camera', 'yanko', 'design', 'latest', 'iphone', 'flip', 'phone', 'camera', 'lens', 'telephone', 'multi', 'tasking']"
Pinterest,2025-11-03T13:59:10.186075,iphone 17 pro,https://www.pinterest.com/pin/16747829861801039/,the iphone 17 color lineup revealed,the iphone 17 color lineup revealed,,,,the iphone lineup revealed,"['iphone', 'lineup', 'revealed']"
Pinterest,2025-11-03T13:59:10.186075,iphone 17 pro,https://www.pinterest.com/pin/431571576815339059/,two white iphones sitting next to each other on top of a cloth covered surface,two white iphones sitting next to each other on top of a cloth covered surface,,,,two white iphones sitting next to each other on top of a cloth covered surface,"['two', 'white', 'iphones', 'sitting', 'next', 'top', 'cloth', 'covered', 'surface']"
Pinterest,2025-11-03T13:59:10.186075,iphone 17 pro,https://www.pinterest.com/pin/935622891344771873/,an iphone 17 action button setup for customize tips and tricks,an iphone 17 action button setup for customize tips and tricks,,,,an iphone action button setup for customize tips and tricks,"['iphone', 'action', 'button', 'setup', 'customize', 'tip', 'trick']"
Google RSS,2025-11-03T13:59:13.458791,iphone 17 pro,https://news.google.com/rss/articles/CBMitwFBVV95cUxOOW9FSG5uVWZ4Qk9kOTNfUEZpWDBwYnJoWndPU2Foa0FsWE1WUHZ3Z2Q0MHdUc0hzLWh1dVp6b3c5QmVtUzRGVHV0R3VCN2dhTVhFX3c5aElBWE1UNnVkRDZYWDNfckllcXRoeDItdzVzRU1ITlo1WEc3N0JsbFNmVFVsTzdNRk4xaHdZTC14ZWczakxmN19BMWVpSHNfWUlHai0xZ2dvMWk4RVNBYk54bkxMYmdRWjg?oc=5,I’ve spent one month with the iPhone 17 Pro Max — 5 things I like and 2 I don’t - Tom's Guide,"<a href=""https://news.google.com/rss/articles/CBMitwFBVV95cUxOOW9FSG5uVWZ4Qk9kOTNfUEZpWDBwYnJoWndPU2Foa0FsWE1WUHZ3Z2Q0MHdUc0hzLWh1dVp6b3c5QmVtUzRGVHV0R3VCN2dhTVhFX3c5aElBWE1UNnVkRDZYWDNfckllcXRoeDItdzVzRU1ITlo1WEc3N0JsbFNmVFVsTzdNRk4xaHdZTC14ZWczakxmN19BMWVpSHNfWUlHai0xZ2dvMWk4RVNBYk54bkxMYmdRWjg?oc=5"" target=""_blank"">I’ve spent one month with the iPhone 17 Pro Max — 5 things I like and 2 I don’t</a>&nbsp;&nbsp;<font color=""#6f6f6f"">Tom's Guide</font>",,,,i ve spent one month with the iphone pro max things i like and i don t tom s guide,"['spent', 'one', 'month', 'iphone', 'pro', 'max', 'thing', 'like', 'tom', 'guide']"
Google RSS,2025-11-03T13:59:13.458791,iphone 17 pro,https://news.google.com/rss/articles/CBMi6AFBVV95cUxPdi1md0xLcVRwQkZOOFd4b0ZKRFRqSU82dGtsWDRxMy1MNmhncXVjVW5qX0hpTll3QnFPRkJfZEtLNUI3V1NjcHJrUFFyQVFndFZRZ0Z0cldwX01zTmhEQUR4MzlEYVhyOHc3bkJrNENienNWTExHSlZKeWFvYVZOakszZG4zdllVTXhhd3pJck84STZnQ0plZjNnUEZ4YW1CZ2lJQ3d6a2ttSExmaHFiSzFkajJzT2VmMnZqQXRSMnc2Q01Ua2VaNzE0UjRGbF8xLXlfZzFJSXN4VEJvRnpod3NrelJKVVNI?oc=5,Xiaomi 17 Pro Max smartphone review – Does the giant phone's second display help it step out of Apple's shadow? - Notebookcheck,"<a href=""https://news.google.com/rss/articles/CBMi6AFBVV95cUxPdi1md0xLcVRwQkZOOFd4b0ZKRFRqSU82dGtsWDRxMy1MNmhncXVjVW5qX0hpTll3QnFPRkJfZEtLNUI3V1NjcHJrUFFyQVFndFZRZ0Z0cldwX01zTmhEQUR4MzlEYVhyOHc3bkJrNENienNWTExHSlZKeWFvYVZOakszZG4zdllVTXhhd3pJck84STZnQ0plZjNnUEZ4YW1CZ2lJQ3d6a2ttSExmaHFiSzFkajJzT2VmMnZqQXRSMnc2Q01Ua2VaNzE0UjRGbF8xLXlfZzFJSXN4VEJvRnpod3NrelJKVVNI?oc=5"" target=""_blank"">Xiaomi 17 Pro Max smartphone review – Does the giant phone's second display help it step out of Apple's shadow?</a>&nbsp;&nbsp;<font color=""#6f6f6f"">Notebookcheck</font>",,,,xiaomi pro max smartphone review does the giant phone s second display help it step out of apple s shadow notebookcheck,"['xiaomi', 'pro', 'max', 'smartphone', 'review', 'giant', 'phone', 'second', 'display', 'help', 'step', 'apple', 'shadow', 'notebookcheck']"
Google RSS,2025-11-03T13:59:13.458791,iphone 17 pro,https://news.google.com/rss/articles/CBMiswFBVV95cUxNQjRXYlEyWVhPd1BOdlp0RjFfRlZtWlVVdS04czFrQndHWkVUZVpaSlhRYnNfNV9TUGUwbEsxd296ckNxUlprMDcxMzhIUG5wZjU0U1EyNTRoTWdvWWY1QU5mN1NIV09WSGU5YnprUWFIVVFGUUI3X2NtbGhmZHJWLXJLM0dMVVU5MXZrU2pfVER2RmVXZUdJR2VheGhjYV9lYVQwMEtxMFhwV3NrUUZkT0hYRQ?oc=5,I Need Samsung to Steal These 3 iPhone 17 Pro Features for the Galaxy S26 Ultra - CNET,"<a href=""https://news.google.com/rss/articles/CBMiswFBVV95cUxNQjRXYlEyWVhPd1BOdlp0RjFfRlZtWlVVdS04czFrQndHWkVUZVpaSlhRYnNfNV9TUGUwbEsxd296ckNxUlprMDcxMzhIUG5wZjU0U1EyNTRoTWdvWWY1QU5mN1NIV09WSGU5YnprUWFIVVFGUUI3X2NtbGhmZHJWLXJLM0dMVVU5MXZrU2pfVER2RmVXZUdJR2VheGhjYV9lYVQwMEtxMFhwV3NrUUZkT0hYRQ?oc=5"" target=""_blank"">I Need Samsung to Steal These 3 iPhone 17 Pro Features for the Galaxy S26 Ultra</a>&nbsp;&nbsp;<font color=""#6f6f6f"">CNET</font>",,,,i need samsung to steal these iphone pro features for the galaxy s ultra cnet,"['need', 'samsung', 'steal', 'iphone', 'pro', 'feature', 'galaxy', 'ultra', 'cnet']"
Google RSS,2025-11-03T13:59:13.458791,iphone 17 pro,https://news.google.com/rss/articles/CBMiZ0FVX3lxTFBrZ3BUbEFMTVlNZi02M3BWbFJlWmpkVFJWcXZ2bE1OOHpOWFI1UGg1a3Frb0xFeVdDNW10UlVqR2JSRy1UV2J3WmZQNXl4Zm9iR0JqZEZWTDlSVDQwSkJRamp4VVNPTzg?oc=5,"iPhone 18 Pro Colors Leaked, And Some Fans Won't Be Happy - bgr.com","<a href=""https://news.google.com/rss/articles/CBMiZ0FVX3lxTFBrZ3BUbEFMTVlNZi02M3BWbFJlWmpkVFJWcXZ2bE1OOHpOWFI1UGg1a3Frb0xFeVdDNW10UlVqR2JSRy1UV2J3WmZQNXl4Zm9iR0JqZEZWTDlSVDQwSkJRamp4VVNPTzg?oc=5"" target=""_blank"">iPhone 18 Pro Colors Leaked, And Some Fans Won't Be Happy</a>&nbsp;&nbsp;<font color=""#6f6f6f"">bgr.com</font>",,,,iphone pro colors leaked and some fans won t be happy bgr com,"['iphone', 'pro', 'color', 'leaked', 'fan', 'happy', 'bgr', 'com']"
Google RSS,2025-11-03T13:59:13.458791,iphone 17 pro,https://news.google.com/rss/articles/CBMirAFBVV95cUxPemktR016ck1Eb2pCc2RLMm9MazR5c2x5U0xSUVVfeDNwYzhDeXByaEkyY3NoYVhzVk5WX29nc2QwV3FZWFBMVWN6V0dzcy1ZM0ZoZUlmWUw2TWo5UHdlY0s1ZFFlSUViaU5lVzNiRFJlekpGLWZtSU1YZUZOV1pQZFFYYjZDX2NsanB6U2VoaXdsSmpHQUZFTDVTUGRhbkpNY3o5V0dHQUdhOXZN?oc=5,Three new colors rumored for the iPhone 18 — here’s what you could get - Tom's Guide,"<a href=""https://news.google.com/rss/articles/CBMirAFBVV95cUxPemktR016ck1Eb2pCc2RLMm9MazR5c2x5U0xSUVVfeDNwYzhDeXByaEkyY3NoYVhzVk5WX29nc2QwV3FZWFBMVWN6V0dzcy1ZM0ZoZUlmWUw2TWo5UHdlY0s1ZFFlSUViaU5lVzNiRFJlekpGLWZtSU1YZUZOV1pQZFFYYjZDX2NsanB6U2VoaXdsSmpHQUZFTDVTUGRhbkpNY3o5V0dHQUdhOXZN?oc=5"" target=""_blank"">Three new colors rumored for the iPhone 18 — here’s what you could get</a>&nbsp;&nbsp;<font color=""#6f6f6f"">Tom's Guide</font>",,,,three new colors rumored for the iphone here s what you could get tom s guide,"['three', 'new', 'color', 'rumored', 'iphone', 'could', 'get', 'tom', 'guide']"
Google RSS,2025-11-03T13:59:13.458791,iphone 17 pro,https://news.google.com/rss/articles/CBMi2gFBVV95cUxNNks2VUgxQWhnNTZ1T2VxTHZCbFdZMnJQdy1sMFRBMFYyMmkwalJjWTRHWGpVUXJpYWRBZE4zV0tvbXU3YjVEcEZkMEloUkNxWmxXSk1WQ3B2UmVVbVhEallfUlo4NXhGM1ZsaTZOeVBVNWRERjN3YkVnemtERWc4UUY1c0JfWGpkVVJKaE1ZNXd6QXIxaHZKSldxMi1EZzRGNm05RjVJN0EtS2lFTWEzZEN3c1BvN3JoaW9RTDlwcjNmREFTNU9hUXBsZFN6X2NFeTk5TTNhMHpNZ9IB3wFBVV95cUxNaTFuY2puSE5FUnZmbC1ZVkhWZmEycUFtSWZrUlI3RjF5WEdaVWFRSVhjNF9raGpEM1cwWWJJcy03N21wUGJ6SlpxVEg1TUMzblV0dVozTzloVWVoaUpBaGM4Um5pYXh4YUw5XzlxSEp2a3NjUUcwbXVhcXcwMmlVZHBDbklVcDl3NjV3MUtwNjBSN2tGN1o0MzQ2eWZoSzByRndJaGVIbXVULUkxNElfZWVrLXlZS3JkTFJHcVBsSFdxcEExa0x6UW91WE9zR3A5Y2V5LW5VQllOUWI4N1JF?oc=5,iPhone 18 Pro: 7 reasons why not buying iPhone 17 Pro and waiting may make sense | Hindustan Times - Hindustan Times,"<a href=""https://news.google.com/rss/articles/CBMi2gFBVV95cUxNNks2VUgxQWhnNTZ1T2VxTHZCbFdZMnJQdy1sMFRBMFYyMmkwalJjWTRHWGpVUXJpYWRBZE4zV0tvbXU3YjVEcEZkMEloUkNxWmxXSk1WQ3B2UmVVbVhEallfUlo4NXhGM1ZsaTZOeVBVNWRERjN3YkVnemtERWc4UUY1c0JfWGpkVVJKaE1ZNXd6QXIxaHZKSldxMi1EZzRGNm05RjVJN0EtS2lFTWEzZEN3c1BvN3JoaW9RTDlwcjNmREFTNU9hUXBsZFN6X2NFeTk5TTNhMHpNZ9IB3wFBVV95cUxNaTFuY2puSE5FUnZmbC1ZVkhWZmEycUFtSWZrUlI3RjF5WEdaVWFRSVhjNF9raGpEM1cwWWJJcy03N21wUGJ6SlpxVEg1TUMzblV0dVozTzloVWVoaUpBaGM4Um5pYXh4YUw5XzlxSEp2a3NjUUcwbXVhcXcwMmlVZHBDbklVcDl3NjV3MUtwNjBSN2tGN1o0MzQ2eWZoSzByRndJaGVIbXVULUkxNElfZWVrLXlZS3JkTFJHcVBsSFdxcEExa0x6UW91WE9zR3A5Y2V5LW5VQllOUWI4N1JF?oc=5"" target=""_blank"">iPhone 18 Pro: 7 reasons why not buying iPhone 17 Pro and waiting may make sense | Hindustan Times</a>&nbsp;&nbsp;<font color=""#6f6f6f"">Hindustan Times</font>",,,,iphone pro reasons why not buying iphone pro and waiting may make sense hindustan times hindustan times,"['iphone', 'pro', 'reason', 'buying', 'iphone', 'pro', 'waiting', 'may', 'make', 'sense', 'hindustan', 'time', 'hindustan', 'time']"
Google RSS,2025-11-03T13:59:13.458791,iphone 17 pro,https://news.google.com/rss/articles/CBMiqwFBVV95cUxNdVBrWjdvVm1GVm5hVmJqT3FFUmtfUDhmb3M2WmIxejFUVGpSUG1sY2M3dWJsWG9zTF9QR216bW80RWd0SndvekdrMmtaQ2sxSmY5b25KbV9MLUJQRFJ0ZGVpempuSUdoVk1VU0loRzA3d3l3SVhaNFZ0NmhVa2pNRjlQLUtWdC1ReURGWUJtcVgzUmxUNTNBSGhjTkNtZ0V1U1VacEtRcTNEaWc?oc=5,Most of you seem to love that the iPhone 17 Pro can act like a chameleon - PhoneArena,"<a href=""https://news.google.com/rss/articles/CBMiqwFBVV95cUxNdVBrWjdvVm1GVm5hVmJqT3FFUmtfUDhmb3M2WmIxejFUVGpSUG1sY2M3dWJsWG9zTF9QR216bW80RWd0SndvekdrMmtaQ2sxSmY5b25KbV9MLUJQRFJ0ZGVpempuSUdoVk1VU0loRzA3d3l3SVhaNFZ0NmhVa2pNRjlQLUtWdC1ReURGWUJtcVgzUmxUNTNBSGhjTkNtZ0V1U1VacEtRcTNEaWc?oc=5"" target=""_blank"">Most of you seem to love that the iPhone 17 Pro can act like a chameleon</a>&nbsp;&nbsp;<font color=""#6f6f6f"">PhoneArena</font>",,,,most of you seem to love that the iphone pro can act like a chameleon phonearena,"['seem', 'love', 'iphone', 'pro', 'act', 'like', 'chameleon', 'phonearena']"
Google RSS,2025-11-03T13:59:13.458791,iphone 17 pro,https://news.google.com/rss/articles/CBMif0FVX3lxTE0yVTBnRnFSOVExYWpPYUs3anU0Z2R5dW9xRW9tclJIUHFJREtBRzhNNkFKWVVCSWZFZ2lyMXBYTDhTYkVUbHJSRmsyTEFpekY2NWxFNXhMaVF2LVpPQ1E2Rm1MU1czaWpLM1lLQnQ1VU41cFBmZlBPTUI3NEhEbFU?oc=5,I’m an iPhones expert – change these settings on your iPhone 17 now - Tech Advisor,"<a href=""https://news.google.com/rss/articles/CBMif0FVX3lxTE0yVTBnRnFSOVExYWpPYUs3anU0Z2R5dW9xRW9tclJIUHFJREtBRzhNNkFKWVVCSWZFZ2lyMXBYTDhTYkVUbHJSRmsyTEFpekY2NWxFNXhMaVF2LVpPQ1E2Rm1MU1czaWpLM1lLQnQ1VU41cFBmZlBPTUI3NEhEbFU?oc=5"" target=""_blank"">I’m an iPhones expert – change these settings on your iPhone 17 now</a>&nbsp;&nbsp;<font color=""#6f6f6f"">Tech Advisor</font>",,,,i m an iphones expert change these settings on your iphone now tech advisor,"['iphones', 'expert', 'change', 'setting', 'iphone', 'tech', 'advisor']"
Google RSS,2025-11-03T13:59:13.458791,iphone 17 pro,https://news.google.com/rss/articles/CBMi1gFBVV95cUxPSlR4U3AzUnpIZ1VpSXFZczV1SHJJQXBjWG85aTdHbGhnWkE4V3o4dGN0a211SVg0QU5kSVhTQ2N5ZUQ5dExtWDl1MGREeTdzeXZGc09UZ2FXZS13MnFsaG1vcTFPZ2pNdWhjVk9lMXg0SFVwdEMyZ2JVOXJCTGgwbS0wVHVsZXBrWFZxUmxOS0xhNDZKVUJYV29XcFB3YkVNbklGLWxiZ3ByWnNJb0FiUFE1bmhKNVQ5NGxkQkJCSUdTRTdIRWJ1X2d6eHJHWjJnMWszR3FR0gHbAUFVX3lxTE1RNDRtWjVPTFZ5Vk5zeGdXQ25vWGRuSnlGaEd6UThmUXFXd3JNZ010SmYxc01ueW5ycVNqcXIwNjVEQTFFdS1VVW1YUEpaVGlRMTFoLV9JZHZ0REdrMTdwVHUyMXlNYzZKTGkzSTJHbjJiaXI1Q28tNU9MQi1xeWh3WkY2SHBMUXYyaGxNTHIxNzVPcnBxWXNPZUVlcGdPc3AwdDVlbDEzYXFvNmNHOVEySjFCaWxTM0RqbTJVQ29yRlc3bWR2Vjk3OU1ldm4wZ1c3czQ0c0VnN1NONA?oc=5,Which is which? This Android phone looks too much like iPhone 17 Pro Max - livemint.com,"<a href=""https://news.google.com/rss/articles/CBMi1gFBVV95cUxPSlR4U3AzUnpIZ1VpSXFZczV1SHJJQXBjWG85aTdHbGhnWkE4V3o4dGN0a211SVg0QU5kSVhTQ2N5ZUQ5dExtWDl1MGREeTdzeXZGc09UZ2FXZS13MnFsaG1vcTFPZ2pNdWhjVk9lMXg0SFVwdEMyZ2JVOXJCTGgwbS0wVHVsZXBrWFZxUmxOS0xhNDZKVUJYV29XcFB3YkVNbklGLWxiZ3ByWnNJb0FiUFE1bmhKNVQ5NGxkQkJCSUdTRTdIRWJ1X2d6eHJHWjJnMWszR3FR0gHbAUFVX3lxTE1RNDRtWjVPTFZ5Vk5zeGdXQ25vWGRuSnlGaEd6UThmUXFXd3JNZ010SmYxc01ueW5ycVNqcXIwNjVEQTFFdS1VVW1YUEpaVGlRMTFoLV9JZHZ0REdrMTdwVHUyMXlNYzZKTGkzSTJHbjJiaXI1Q28tNU9MQi1xeWh3WkY2SHBMUXYyaGxNTHIxNzVPcnBxWXNPZUVlcGdPc3AwdDVlbDEzYXFvNmNHOVEySjFCaWxTM0RqbTJVQ29yRlc3bWR2Vjk3OU1ldm4wZ1c3czQ0c0VnN1NONA?oc=5"" target=""_blank"">Which is which? This Android phone looks too much like iPhone 17 Pro Max</a>&nbsp;&nbsp;<font color=""#6f6f6f"">livemint.com</font>",,,,which is which this android phone looks too much like iphone pro max livemint com,"['android', 'phone', 'look', 'much', 'like', 'iphone', 'pro', 'max', 'livemint', 'com']"
Google RSS,2025-11-03T13:59:13.458791,iphone 17 pro,https://news.google.com/rss/articles/CBMi4AFBVV95cUxQU2RabUhEVXFsbTUwcEFJSmR3X2xWd3hVbHZHNUxQeVRVWXZ6NWM3RFNxN25jT1gzQVZBenB3ZmNnWmdDdlVTNFdvYkQwRk43elBrRGc1TGdEZGdRd3VXazIxcF9rMFlXUWxDd1RBV2ZEb1g1S285Mk1lRlhFaDhEaThqaldjeDgxWGVoUlVXTG1zbGwwNHNwSmt0TFVJZjhCcWdaazlDdFNuWmxMYzZuVENpMlVwZWVUNWRWT3BpTmZVWjZNY3N3QkdiR1kyZVZrZG8xWGZPSEZCUFlucFhQUQ?oc=5,"If the iPhone 17 Pro Max goes on sale this Black Friday, I'll eat my hat – here's why - TechRadar","<a href=""https://news.google.com/rss/articles/CBMi4AFBVV95cUxQU2RabUhEVXFsbTUwcEFJSmR3X2xWd3hVbHZHNUxQeVRVWXZ6NWM3RFNxN25jT1gzQVZBenB3ZmNnWmdDdlVTNFdvYkQwRk43elBrRGc1TGdEZGdRd3VXazIxcF9rMFlXUWxDd1RBV2ZEb1g1S285Mk1lRlhFaDhEaThqaldjeDgxWGVoUlVXTG1zbGwwNHNwSmt0TFVJZjhCcWdaazlDdFNuWmxMYzZuVENpMlVwZWVUNWRWT3BpTmZVWjZNY3N3QkdiR1kyZVZrZG8xWGZPSEZCUFlucFhQUQ?oc=5"" target=""_blank"">If the iPhone 17 Pro Max goes on sale this Black Friday, I'll eat my hat – here's why</a>&nbsp;&nbsp;<font color=""#6f6f6f"">TechRadar</font>",,,,if the iphone pro max goes on sale this black friday i ll eat my hat here s why techradar,"['iphone', 'pro', 'max', 'go', 'sale', 'black', 'friday', 'eat', 'hat', 'techradar']"
Google RSS,2025-11-03T13:59:13.458791,iphone 17 pro,https://news.google.com/rss/articles/CBMixgFBVV95cUxPQ0NfZEtCYnh6ZDFTanBXSTZVSUw4c2NnMWRGXzJod2kzUFVvajIxWkZJSm85Z2E1cXdHVWp1ekk1X2JYNmotNmdmVWF3LXhaS3R6aUk5NUsyMDRKaHdnZXppT0xqeHdCWG5KdUNQZVIzaEMxTE9GMkljWGRQMzZQS0YwOEsyYi1aaWFQcUk4dWJpY1RtMXZtSjZWdnZINU54VVBNSzA3d2NUZ1pKRWRqRjBTNWtmOVJpRTAxZ2kxektDTmo4cVE?oc=5,I Cracked My iPhone 17 Pro Max Screen. Here's What Surprised Me About Using AppleCare to Fix It - CNET,"<a href=""https://news.google.com/rss/articles/CBMixgFBVV95cUxPQ0NfZEtCYnh6ZDFTanBXSTZVSUw4c2NnMWRGXzJod2kzUFVvajIxWkZJSm85Z2E1cXdHVWp1ekk1X2JYNmotNmdmVWF3LXhaS3R6aUk5NUsyMDRKaHdnZXppT0xqeHdCWG5KdUNQZVIzaEMxTE9GMkljWGRQMzZQS0YwOEsyYi1aaWFQcUk4dWJpY1RtMXZtSjZWdnZINU54VVBNSzA3d2NUZ1pKRWRqRjBTNWtmOVJpRTAxZ2kxektDTmo4cVE?oc=5"" target=""_blank"">I Cracked My iPhone 17 Pro Max Screen. Here's What Surprised Me About Using AppleCare to Fix It</a>&nbsp;&nbsp;<font color=""#6f6f6f"">CNET</font>",,,,i cracked my iphone pro max screen here s what surprised me about using applecare to fix it cnet,"['cracked', 'iphone', 'pro', 'max', 'screen', 'surprised', 'using', 'applecare', 'fix', 'cnet']"
Google RSS,2025-11-03T13:59:13.458791,iphone 17 pro,https://news.google.com/rss/articles/CBMiwwFBVV95cUxPR2VqbkpESHZwN1REeWJXOXRZTW9sWmYtUU5aNU9CTWFiRTBlLXhFQ3M2U3c1V25TdEVlNVlzY3RBYjYzc3czRzZzX2Jna256SjlDWjAwOVhKQ2ZnOTVGU01QRXVXbWNhck94MEdsdWE2d09qcTBKM3pwR1EwT3Rhal9wcUNjTm81bmM4ZW9FaGZIMFBmSTBEWHE0VW5zYjJmV1VLYmJZTzhzdUdGZXVmcG1qaWhYR09VeDhKVkloUTl1VkE?oc=5,The iPhone 17's Camera Control button has become a nuisance — here's how I turned it off - Tom's Guide,"<a href=""https://news.google.com/rss/articles/CBMiwwFBVV95cUxPR2VqbkpESHZwN1REeWJXOXRZTW9sWmYtUU5aNU9CTWFiRTBlLXhFQ3M2U3c1V25TdEVlNVlzY3RBYjYzc3czRzZzX2Jna256SjlDWjAwOVhKQ2ZnOTVGU01QRXVXbWNhck94MEdsdWE2d09qcTBKM3pwR1EwT3Rhal9wcUNjTm81bmM4ZW9FaGZIMFBmSTBEWHE0VW5zYjJmV1VLYmJZTzhzdUdGZXVmcG1qaWhYR09VeDhKVkloUTl1VkE?oc=5"" target=""_blank"">The iPhone 17's Camera Control button has become a nuisance — here's how I turned it off</a>&nbsp;&nbsp;<font color=""#6f6f6f"">Tom's Guide</font>",,,,the iphone s camera control button has become a nuisance here s how i turned it off tom s guide,"['iphone', 'camera', 'control', 'button', 'become', 'nuisance', 'turned', 'tom', 'guide']"
Google RSS,2025-11-03T13:59:13.458791,iphone 17 pro,https://news.google.com/rss/articles/CBMif0FVX3lxTFBZdUk0SEFJektrRlJVLWRkNkxVa3A0OFJGd3I2Y2tISkJfWG1Nb3NZbDRFUnROSFFhVllQQzlLdDlSRXpkM0NxdE4yekJtdTVwOHVCZFNCODVFSVpKckZIVTlGLV9HR0hLZDZLSEF0MjhuVDB0M2hQLVFaN1I4X3c?oc=5,I've been using the iPhone 17 Pro for a month — what I like (and what I don't) - Currently.com,"<a href=""https://news.google.com/rss/articles/CBMif0FVX3lxTFBZdUk0SEFJektrRlJVLWRkNkxVa3A0OFJGd3I2Y2tISkJfWG1Nb3NZbDRFUnROSFFhVllQQzlLdDlSRXpkM0NxdE4yekJtdTVwOHVCZFNCODVFSVpKckZIVTlGLV9HR0hLZDZLSEF0MjhuVDB0M2hQLVFaN1I4X3c?oc=5"" target=""_blank"">I've been using the iPhone 17 Pro for a month — what I like (and what I don't)</a>&nbsp;&nbsp;<font color=""#6f6f6f"">Currently.com</font>",,,,i ve been using the iphone pro for a month what i like and what i don t currently com,"['using', 'iphone', 'pro', 'month', 'like', 'currently', 'com']"
